{
  "schema_version": "1",
  "created_at": "2026-10-28T00:00:00Z",
  "kind": "fact",
  "scope": "fictional-garden",
  "source": "fictional:user-message",
  "authority": "user-stated",
  "status": "active",
  "source_device_id": "fictional-device",
  "id": "garden-old",
  "statement": "Garden theme is blue"
}
